_id;descripcion;medida;importe;espece;createdAt;updatedAt
1;CALIFICACION DE DOCUMENTOS;UNIDAD;15;1.3. 210. 1 5;22/06/2025 22:44;22/06/2025 22:44
2;EXPEDICION COPIA NOTARIALES: SEPARACION DE BIENES;FOJA;15;1.3. 210. 1 5;23/06/2025 22:44;23/06/2025 22:44
3;EXPEDICION COPIA NOTARIALES: COMPRA-VENTA;FOJA;15;1.3. 210. 1 5;24/06/2025 22:44;24/06/2025 22:44
4;EXPEDICION COPIA NOTARIAL: TRANSACCION Y RECONOCIMIENTO;FOJA;15;1.3. 210. 1 5;25/06/2025 22:44;25/06/2025 22:44
5;EXPEDICION COPIA NOTARIALES: TESTAMENTO;FOJA;15;1.3. 210. 1 5;26/06/2025 22:44;26/06/2025 22:44
6;DESARCHIVAMIENTO DE DOCUMENTO: TESTAMENTO;UNIDAD;10;1.3. 210. 1 5;27/06/2025 22:44;27/06/2025 22:44
7;SERVICIO DE CAPACITACION ARCHIVISTICA;HORA;50;1.3. 210. 1 5;28/06/2025 22:44;28/06/2025 22:44
8;DESARCHIVAMIENTO DE DOCUMENTOS: PLANILLAS;UNIDAD;10;1.3. 210. 1 5;29/06/2025 22:44;29/06/2025 22:44
9;EXPEDICION COPIA SIMPLE;FOJA;0.2;1.3. 210. 1 5;30/06/2025 22:44;30/06/2025 22:44
11;REGULARIZACION DE ESCRITURA PUBLICA: DICTAMEN TECNICO;UNIDAD;85;1.3. 210. 1 5;01/07/2025 22:44;01/07/2025 22:44
12;REGULARIZACION DE ESCRITURA PUBLICA: DILIGENCIA;UNIDAD;65;1.3. 210. 1 5;02/07/2025 22:44;02/07/2025 22:44
13;EXPEDICION COPIA CERIFICADA NOTARIAL:;FOJA;15;1.3. 210. 1 5;03/07/2025 22:44;03/07/2025 22:44
14;DESARCHIVAMIENTO DE DOCUMENTO: ESCRITURA PUBLICA;UNIDAD;10;1.3. 210. 1 5;04/07/2025 22:44;04/07/2025 22:44
15;DESARCHIVAMIENTO DE DOCUMENTO: EXPEDIENTE JUDICIAL;UNIDAD;10;1.3. 210. 1 5;05/07/2025 22:44;05/07/2025 22:44
16;DESARCHIVAMIENTO DE DOCUMENTO: IMPUESTO SUCESORIO;UNIDAD;10;1.3. 210. 1 5;06/07/2025 22:44;06/07/2025 22:44
17;DESARCHIVAMIENTO DE DOCUMENTO: DOCUMENTOS ADMINISTRATIVOS;UNIDAD;10;1.3. 210. 1 5;07/07/2025 22:44;07/07/2025 22:44
18;DESARCHIVAMIENTO DE DOCUMENTOS: PARTIDA DE MATRIMONIO;UNIDAD;10;1.3. 210. 1 5;08/07/2025 22:44;08/07/2025 22:44
19;DESARCHIVAMIENTO DE DOCUMENTOS: PARTIDA DE DEFUNCION;UNIDAD;10;1.3. 210. 1 5;09/07/2025 22:44;09/07/2025 22:44
20;DESARCHIVAMIENTO DE DOCUMENTOS: MINUTA;UNIDAD;10;1.3. 210. 1 5;10/07/2025 22:44;10/07/2025 22:44
21;DESARCHIVAMIENTO DE DOCUMENTOS: PARTIDA DE NACIMIENTO;UNIDAD;10;1.3. 210. 1 5;11/07/2025 22:44;11/07/2025 22:44
22;DESARCHIVAMIENTO DE DOCUMENTOS: LIBRO DE EXTRANJERIA;UNIDAD;10;1.3. 210. 1 5;12/07/2025 22:44;12/07/2025 22:44
23;EXHIBICION DE DOCUMENTOS: ESCRITURA PUBLICA;UNIDAD;10;1.3. 210. 1 5;13/07/2025 22:44;13/07/2025 22:44
24;EXHIBICION DE DOCUMENTOS: EXPEDIENTE JUDICIAL;UNIDAD;10;1.3. 210. 1 5;14/07/2025 22:44;14/07/2025 22:44
25;EXHIBICION DE DOCUMENTOS: REGISTRO CIVIL;UNIDAD;10;1.3. 210. 1 5;15/07/2025 22:44;15/07/2025 22:44
27;EXPEDICION DE CONSTANCIA NOTARIAL;UNIDAD;14;1.3. 210. 1 5;16/07/2025 22:44;16/07/2025 22:44
30;EXPEDICION DE CONSTANCIA DE EXPEDIENTE JUDICIAL;UNIDAD;14;1.3. 210. 1 5;17/07/2025 22:44;17/07/2025 22:44
31;EXPEDICION DE CONSTANCIA DE REGISTRO CIVIL;UNIDAD;14;1.3. 210. 1 5;18/07/2025 22:44;18/07/2025 22:44
32;EXPEDICION DE CONSTANCIA DE PLANILLAS;UNIDAD;14;1.3. 210. 1 5;19/07/2025 22:44;19/07/2025 22:44
35;ANOTACION DE MATRIZ;UNIDAD;9;1.3. 210. 1 5;20/07/2025 22:44;20/07/2025 22:44
36;EXPEDICION DE COPIA AUTENTIFICADA PARA USO EN EL EXTERIOR;UNIDAD;28;1.3. 210. 1 5;21/07/2025 22:44;21/07/2025 22:44
38;EXPEDICION COPIA CERTIFICADA DE MINUTA;FOJA;15;1.3. 210. 1 5;22/07/2025 22:44;22/07/2025 22:44
39;EXPEDICION COPIA CERTIFICADA DE IMPUESTO SUCESORIO;FOJA;15;1.3. 210. 1 5;23/07/2025 22:44;23/07/2025 22:44
40;EXPEDICION COPIA CERTIFICADA DE PARTIDA DE NACIMIENTO;FOJA;15;1.3. 210. 1 5;24/07/2025 22:44;24/07/2025 22:44
41;EXPEDICION COPIA CERTIFICADA DE LIBRO DE EXTRANJERIA;FOJA;15;1.3. 210. 1 5;25/07/2025 22:44;25/07/2025 22:44
42;EXPEDICION COPIA CERTIFICADA DE PLANILLAS;FOJA;15;1.3. 210. 1 5;26/07/2025 22:44;26/07/2025 22:44
43;EXPEDICION COPIA CERTIFICADA DE EXPEDIENTE JUDICIAL;FOJA;15;1.3. 210. 1 5;27/07/2025 22:44;27/07/2025 22:44
44;EXPEDICION COPIA CERTIFICADA DE PARTIDA DE MATRIMONIO;FOJA;15;1.3. 210. 1 5;28/07/2025 22:44;28/07/2025 22:44
45;EXPEDICION COPIA CERTIFICADA DE PARTIDA DE DEFUNCION;FOJA;15;1.3. 210. 1 5;29/07/2025 22:44;29/07/2025 22:44
46;FOTOCOPIA AL INVESTIGADOR - T/A4;UNIDAD;0,2;1.3. 210. 1 5;30/07/2025 22:44;30/07/2025 22:44
48;FOTOCOPIA AL INVESTIGADOR - T/A3;UNIDAD;0.4;1.3. 210. 1 5;31/07/2025 22:44;31/07/2025 22:44
50;TRANSCRIPCION PALEOGRAFICA AUTENTICADA DE DOCUMENTOS;UNIDAD;20;1.3. 210. 1 5;01/08/2025 22:44;01/08/2025 22:44
51;EXPEDICION COPIA CERTIFICADA DE INMIGRANTE;UNIDAD;15;1.3. 210. 1 5;02/08/2025 22:44;02/08/2025 22:44
57;FOTOGRAFIA DE DOCUMENTO EN CUSTODIA;UNIDAD;10;1.3. 210. 1 5;03/08/2025 22:44;03/08/2025 22:44
58;ACCESO A LA INFORMACION QUE PRODUCE EL ARCHIVO REGIONAL/COPIA SIMPLE;UNIDAD;0.2;1.3. 210. 1 5;04/08/2025 22:44;04/08/2025 22:44
59;EXPEDICION COPIA CERTIFICADA EMPRESAS PRIVADAS;UNIDAD;15;1.3. 210. 1 5;05/08/2025 22:44;05/08/2025 22:44
60;EXPEDICION CONSTANCIA NOTARIAL IRREGULAR;UNIDAD;14;1.3. 210. 1 5;06/08/2025 22:44;06/08/2025 22:44
61;ELIMINACION -  VENTA DE DESUSO ADMINISTRACION PUBLICA;KILOS;0.5;1.3. 210. 1 5;07/08/2025 22:44;07/08/2025 22:44
62;EXPEDICION DE CARNET DE INVESTIGADOR;UNIDAD;5;1.3. 210. 1 5;08/08/2025 22:44;08/08/2025 22:44
63;SERVICIO DE ASESORAMIENTO RECNICO ARCHIVÖSTICO;HORA;50;1.3. 210. 1 5;09/08/2025 22:44;09/08/2025 22:44
64;EXHIBICION DE DOCUMENTOS: PLANILLAS;FOJA;10;1.3. 210. 1 5;10/08/2025 22:44;10/08/2025 22:44
65;CAPACITACION ARCHIVISTICA;HORA;90;1.3. 210. 1 5;11/08/2025 22:44;11/08/2025 22:44
66;CAPACITACION ARCHIVISTICA;HORA;50;1.3. 210. 1 5;12/08/2025 22:44;12/08/2025 22:44
67;CAPACITACIÓN ARCHIVISTICA;HORA;10;1.3. 210. 1 5;13/08/2025 22:44;13/08/2025 22:44
